"NCI-2012-02767","True:Histologically confirmed epithelial ovarian, primary peritoneal or fallopian tube malignancy that is metastatic and for which standard curative measures do not exist","True:Disease confined to the intraperitoneal and retroperitoneal cavity; Note: nodal disease below the diaphragm, implants adherent to the surface of the liver or intrahepatic lesions will not be exclusionary; patients remain eligible if all intrahepatic tumor is debulked or ablated by the time treatment is initiated","True:EXPANSION PHASE ONLY: Evaluable or measurable disease with the largest nodule measuring less than 5 cm in greatest dimension by radiographic imaging after debulking procedure","True:Candidate for and willingness to have a surgically placed intraperitoneal catheter and tissue acquisition at the time of port placement; note: if an intraperitoneal catheter is already in place, a tumor biopsy will still be required; a guided core-needle biopsy is sufficient in these cases","True:Able to swallow and absorb the medication","True:Obtained =< 7 days prior to registration: Absolute neutrophil count (ANC) >= 1500/mm^3","True:Obtained =< 7 days prior to registration: Platelets (PLT) >= 100,000/mm^3","True:Obtained =< 7 days prior to registration: Total bilirubin =< 1.5 x institutional upper limit of normal (ULN)","True:Obtained =< 7 days prior to registration: Creatinine =< 1.5 x institutional ULN","True:Obtained =< 7 days prior to registration: Aspartate aminotransferase (AST) or alanine aminotransferase (ALT) =< 3 x institutional ULN","True:Obtained =< 7 days prior to registration: Hemoglobin (Hgb) > 9.0 mg/dl","True:Eastern Cooperative Oncology Group (ECOG) performance status (PS) 0, 1, or 2","True:Ability to provide informed written consent","True:Life expectancy >= 12 weeks","True:Women of childbearing potential only: negative pregnancy test done =< 7 days prior to registration","False:Known standard therapy for the patient’s disease that is potentially curative or definitely capable of extending life expectancy; note: patients with recurrent platinum-sensitive ovarian, primary peritoneal or fallopian tube will be allowed, if the investigator believes the study treatment is a better alternative to initiation platinum-based chemotherapy, such as patients with a prior platinum allergy or low volume disease for whom platinum-based therapy is deferred until a later date","False:More than 4 prior chemotherapy regimens; note: repeat use of regimens count as 1 prior regimen; switching front-line therapy regimens (for example, from intraperitoneal to intravenous therapy) for reasons other than progression will count as 1 prior therapy; bevacizumab and other ‘targeted’ agents will count in the total number of prior regimens; vaccine therapies will not count in the total of prior therapies","False:Uncontrolled intercurrent illness including, but not limited to, ongoing or active infection, symptomatic congestive heart failure, unstable angina pectoris, cardiac arrhythmia, or psychiatric illness/social situations that would limit compliance with study requirements","False:Any of the following prior therapies:* Chemotherapy =< 28 days prior to registration* Mitomycin C/nitrosoureas =< 42 days prior to registration* Immunotherapy =< 28 days prior to registration* Biologic therapy =< 28 days prior to registration* Radiation therapy =< 28 days prior to registration* Investigational therapy or any ancillary therapy considered investigational (utilized for a non-Food and Drug Administration [FDA] approved indication and in the context of a research investigation) =< 28 days prior to registration* Prior poly (adenosine diphosphate [ADP]-ribose) polymerase (PARP) inhibitor therapy","False:Failure to fully recover from acute, reversible effects of prior chemotherapy regardless of interval since last treatment","False:Significant cardiovascular disease defined as congestive heart failure (New York Heart Association class III or IV cardiac disease), angina pectoris requiring nitrate therapy or recent myocardial infarction (=< 6 months prior to registration)","False:Metastatic disease outside the intraperitoneal cavity and retroperitoneum, intrahepatic lesions, or pleural effusions; significant ascites precluding catheter placement; exception: intrahepatic lesions removed or planning to be removed during the debulking procedure","False:Any of the following:* Nursing women* Pregnant women* Women of childbearing potential who are unwilling to employ adequate contraception (non-barrier method)","False:Immunocompromised patients (other than that related to the use of corticosteroids) with the exception of patients known to be human immunodeficiency virus (HIV) positive and have a cluster of differentiation 4 (CD4) count > 400 and do not require antiretroviral therapy","False:Receiving any other investigational agent that would be considered a treatment for the primary neoplasm","False:Other active malignancy =< 1 year prior to registration* EXCEPTIONS: Non-melanotic skin cancer or carcinoma-in-situ of the cervix* NOTE: If there is a history or prior malignancy, they must not be receiving other specific treatment for their cancer",""
"NCI-2012-02869","True:Female patients presenting with initial diagnosis of any type of cancer","True:Patients must not have initiated chemotherapy or radiation prior to registration to this study","True:Patients must not have had a prior hysterectomy, bilateral oophorectomy or sterilization of any method","True:Patients must be pre-menopausal patients within the reproductive age range","True:Please note, pre-menopausal will be defined as women meeting the following criteria:* Patients not currently on hormonal contraception with the presence of menses in the past 6 months* If no menstruation in the past 6 months, without hormonal manipulation, then confirmed follicle-stimulating hormone (FSH) < 23 mlU/mL* If age < 47 years and on hormonal contraception then patient will be eligible regardless of menstrual history* If age >= 47 years and on hormonal contraception then FSH confirmed < 23 mIU/mL","True:Pregnant women are eligible to participate in this study","True:Patients must have the cognitive ability to participate in the study",""
"NCI-2012-02875","True:Patients must have a diagnosis of metastatic melanoma which is measurable either clinically or radiologically","True:Patients must consent to be in the study and must have signed and dated an approved consent form, which conforms to federal and institutional guidelines","True:Patients must have a performance status of 0 or 1 Eastern Cooperative Oncology Group (ECOG) performance status (PS) scale","True:The ability to provide written informed consent prior to study specific screening procedures, with the understanding that the patient has the right to withdraw from the study at any time","True:Patients’ melanoma must be positive for both tyrosinase and human leukocyte antigen (HLA)-A2 per Loyola University Medical Center pathologic review from fine needle aspiration (FNA)/core/excisional biopsy of lesion","True:Cardiac ejection fraction >= 50% as determined by screening echocardiogram","True:Patients that have undergone treatment with anti-CTLA-4 (Cytotoxic T-Lymphocyte Antigen 4) antibody must have at least 3 months from last dose of CTLA-4 antibody before they can be enrolled into this study","True:The patients BRAF mutation status at position 600 must be known prior to enrollment; patients with V600E mutations are eligible if they have failed an approved BRAF inhibitor or MEK inhibitor therapy or have been offered an approved BRAF inhibitor or MEK inhibitor therapy and refused","True:Patients treated with prior Interleukin-2 will be allowed to be in this study","False:Special classes of subjects such as fetuses, pregnant women, children, prisoners, institutionalized individuals, or others who are likely to be vulnerable","False:ECOG performance status of 2 or greater","False:Patients with a history metastatic melanoma involving the brain will be excluded if they have active disease or have had active disease within the prior six months that was not controlled with surgery or radiotherapy","False:Patients taking steroids for disease control or pain management","False:Patients must not be pregnant or nursing because of the potentially harmful effects of these agents on a developing fetus; women/men of reproductive potential must have agreed to use an effective contraceptive method","False:Patients whose BRAF V600E mutation status is unknown, have the BRAF V600E mutation and are responding to a BRAF inhibitor or MEK inhibitor therapy, or have the BRAF V600E mutation and have not been offered the option of receiving a BRAF inhibitor or MEK inhibitor therapy for the treatment of their melanoma","False:No other prior malignancy is allowed except for the following: adequately treated basal cell or squamous cell skin cancer, in situ cervical cancer, adequately treated Stage I or II cancer from which the patient is currently in complete remission, or any other cancer from which the patient has been disease-free for five years","False:Patients that have undergone Tyrosinase immunotherapy","False:Patients that have undergone immunotherapy in combination with non-myeloablative chemotherapy","False:Absolute neutrophil count < 1.5 x 10^9/L","False:Platelet count < 100 x 10^9/L","False:Serum bilirubin > 1.5 x upper limit of normal (ULN)","False:Serum alanine aminotransferase (ALT), aspartate aminotransferase (AST) > 2.5 x ULN","False:Serum alkaline phosphatase (ALP) > 2 x ULN","False:Serum Albumin < 2.5 g/dL","False:International Normalized Ratio (INR) > 1.5","False:Serum creatinine calculated creatinine clearance by the method of Cockcroft and Gault (< 50mL/min)","False:Patients should not have any evidence of active or uncontrolled infection requiring treatment with antibiotics","False:Any severe or poorly controlled systemic disease (e.g., hypertension; clinically significant cardiovascular, pulmonary, or metabolic disease, disorders of wound healing, ulcer or bone fracture)","False:Patients who have received any chemotherapy or investigational treatment within 4 weeks of study start","False:Known infection with human immunodeficiency virus (HIV), hepatitis B virus (HBV), or hepatitis C virus (HCV)","False:Known hypersensitivity to any of the components of the study drugs","False:Patients assessed by the investigator to be unable or unwilling to comply with the requirements of the protocol",""
"NCI-2012-03124","True:Patients must have histologically or cytologically confirmed soft tissue sarcoma that is metastatic or unresectable and for which standard treatment that prolongs survival does not exist or is no longer effective","True:Patients must have measurable disease, defined as at least one lesion that can be accurately measured in at least one dimension (longest diameter to be recorded for non-nodal lesions and short axis for nodal lesions) as > 20 mm with conventional techniques or as > 10 mm with spiral computed tomography (CT) scan, magnetic resonance imaging (MRI), or calipers by clinical exam","True:Patients are allowed prior VEGFR-tyrosine kinase inhibitor (TKI); patients will be stratified based on prior VEGFR-TKI therapy","True:Eastern Cooperative Oncology Group (ECOG) performance status =< 1 (Karnofsky > 70%)","True:Life expectancy > 3 months","True:Leukocytes >= 3,000/mcL","True:Absolute neutrophil count >= 1,500/mcL","True:Platelets >= 100,000/mcL","True:Total bilirubin =< 1.5 times upper limit of normal (ULN)","True:Aspartate aminotransferase (AST) (serum glutamic oxaloacetic transaminase [SGOT])/alanine aminotransferase (ALT) (serum glutamate pyruvate transaminase [SGPT]) =< 2.5 x institutional upper limit of normal","True:Creatinine within normal institutional limits OR creatinine clearance >= 60 mL/min/1.73 m^2 for patients with creatinine levels above institutional normal","True:Hemoglobin >= 9 g/dL","True:Serum albumin >= 2.8 g/dL","True:Lipase < 2.0 x ULN and no radiologic or clinical evidence of pancreatitis","True:Urine protein/creatinine ratio (UPCR) =< 1","True:Serum phosphorus calcium, magnesium and potassium >= lower limit of normal (LLN)","True:Subjects must have blood pressure (BP) no greater than 140 mmHg (systolic) and 90 mmHg (diastolic) for eligibility; initiation or adjustment of BP medication is permitted prior to study entry provided that the average of three BP readings at the time of enrollment is =< 140/90 mmHg","True:Patients must be able to swallow whole tablets; tablets must not be crushed or chewed","True:Women of child-bearing potential and men must agree to use adequate contraception; all subjects of reproductive potential must agree to use both a barrier method and a second method of birth control during the course of the study and for 4 months after the last dose of study drug(s); sexually active subjects (men and women) must agree to use medically accepted barrier methods of contraception (e.g., male or female condom) during the course of the study and for 4 months after the last dose of study drug(s), even if oral contraceptives are also used","True:Ability to understand and the willingness to sign a written informed consent document","False:Patients who have had anticancer therapy, including kinase inhibitors or any investigational agent within 4 weeks or 5 half-lives (whichever is shorter) (6 weeks for nitrosoureas or mitomycin C) prior to entering the study or those who have not recovered to baseline from adverse events (except alopecia and other non-clinically significant adverse events [AEs]); patients who have received prior cabozantinib or inhibitors of c-MET or HGF are ineligible","False:The subject has received radionuclide treatment within 6 weeks of the first dose of study treatment","False:The subject has received radiation therapy within 4 weeks (=< 2 weeks for palliative radiation therapy)","False:Patients with active brain metastases or carcinomatous meningitis or epidural disease are excluded from this clinical trial; subjects with brain metastases previously treated with whole brain radiation or radiosurgery or subjects with epidural disease previously treated with radiation who are asymptomatic and have remained stable for 4 weeks and do not require steroid treatment for at least 2 weeks before starting study treatment are eligible; neurosurgical resection of brain metastases or brain biopsy is permitted if completed at least 3 months before starting study treatment; baseline brain imaging with contrast-enhanced CT or MRI scans for subjects with known brain metastases is required to confirm eligibility","False:Eligibility of subjects receiving any medications or substances known to affect or with the potential to affect the activity of cabozantinib will be determined following review of their cases by the principal investigator; patients who are taking enzyme-inducing anticonvulsant agents are not eligible","False:Patients with refractory nausea and vomiting, chronic gastrointestinal diseases (e.g., inflammatory bowel disease), or significant bowel resection that could interfere with absorption","False:Uncontrolled intercurrent illness including, but not limited to symptomatic congestive heart failure, unstable angina pectoris, cardiac arrhythmia, or psychiatric illness/social situations that would limit compliance with study requirements","False:Pregnant women are excluded from this study; breastfeeding should be discontinued if the mother is treated with cabozantinib","False:Strong inhibitors and inducers of cytochrome P450, family 3, subfamily A, polypeptide 4 (CYP3A4) should be avoided whenever possible or switched to alternatives; subjects requiring chronic concomitant treatment of strong CYP3A4 inducers (e.g., dexamethasone, phenytoin, carbamazepine, rifampin, rifabutin, rifapentine, phenobarbital, and St. John’s wort) are not eligible for this study","False:Human immunodeficiency virus (HIV)-positive patients on combination antiretroviral therapy are ineligible","False:The subject requires concomitant treatment, in therapeutic doses, with anticoagulants such as warfarin or warfarin-related agents, heparin, thrombin or factor Xa inhibitors, or antiplatelet agents (e.g., clopidogrel); low dose aspirin (=< 81 mg/day), low-dose warfarin (=< 1 mg/day), and prophylactic low molecular weight heparin (LMWH) are permitted (please note that there may be cases in which patients on study require anticoagulation for deep vein thrombosis [DVT]/pulmonary embolism [PE] management; this does not necessitate taking the patient off study)","False:The subject has experienced any of the following* Clinically-significant gastrointestinal bleeding within 3 months before the first dose of study treatment; the participant must be maintained on a prophylactic regimen for management of an upper gastrointestinal (GI) bleeding event with no evidence of recurrence and/or endoscopic confirmation of resolution of the source of a lower GI bleed* Hemoptysis of >= 0.5 teaspoon (2.5 mL) of red blood within 3 months before the first dose of study treatment* Any other signs indicative of pulmonary hemorrhage within 3 months before the first dose of study treatment","False:The subject has radiographic evidence of cavitating pulmonary lesion(s)","False:The subject has tumor invading or encasing any major blood vessels","False:The subject has evidence of tumor invading the GI tract (esophagus, stomach, small or large bowel, rectum or anus), or any evidence of endotracheal or endobronchial tumor within 28 days before the first dose of cabozantinib","False:The subject has uncontrolled, significant intercurrent or recent illness including, but not limited to, the following conditions: * Cardiovascular disorders including: ** Congestive heart failure (CHF): New York Heart Association (NYHA) class III (moderate) or class IV (severe) at the time of screening ** Concurrent uncontrolled hypertension defined as sustained BP > 140 mm Hg systolic, or > 90 mm Hg diastolic despite optimal antihypertensive treatment within 7 days of the first dose of study treatment ** Any history of congenital long QT syndrome ** Any of the following within 6 months before the first dose of study treatment: *** Unstable angina pectoris *** Clinically-significant cardiac arrhythmias *** Stroke (including transient ischemic attack [TIA], or other ischemic event) *** Myocardial infarction *** Thromboembolic event requiring therapeutic anticoagulation (note: subjects with a venous filter [e.g. vena cava filter] are not eligible for this study)* Gastrointestinal disorders particularly those associated with a high risk of perforation or fistula formation including: ** Any of the following within 28 days before the first dose of study treatment*** Intra-abdominal tumor/metastases invading GI mucosa *** Active peptic ulcer disease*** Inflammatory bowel disease (including ulcerative colitis and Crohn’s disease), diverticulitis, cholecystitis, symptomatic cholangitis or appendicitis *** Malabsorption syndrome ** Any of the following within 6 months before the first dose of study treatment: *** Abdominal fistula *** Gastrointestinal perforation *** Bowel obstruction or gastric outlet obstruction *** Intra-abdominal abscess; note: complete resolution of an intra-abdominal abscess must be confirmed prior to initiating treatment with cabozantinib even if the abscess occurred more than 6 months before the first dose of study treatment* Other disorders associated with a high risk of fistula formation including percutaneous endoscopic gastrostomy (PEG) tube placement within 3 months before the first dose of study therapy * Other clinically significant disorders such as: ** Serious non-healing wound/ulcer/bone fracture within 28 days before the first dose of study treatment ** History of organ transplant, including allogeneic bone marrow transplant ** Concurrent uncompensated hypothyroidism or thyroid dysfunction within 7 days before the first dose of study treatment ** History of major surgery as follows:*** Major surgery within 3 months of the first dose of cabozantinib if there were no wound healing complications or within 6 months of the first dose of cabozantinib if there were wound complications *** Minor surgery within 1 month of the first dose of cabozantinib if there were no wound healing complications or within 3 months of the first dose of cabozantinib if there were wound complications ** In addition, complete wound healing from prior surgery must be confirmed at least 28 days before the first dose of cabozantinib irrespective of the time from surgery","False:The subject is unable to swallow tablets","False:The subject has a corrected QT interval calculated by the Fridericia formula (QTcF) > 500 ms within 28 days before enrollment; note: if initial QTcF is found to be > 500 ms, two additional electrocardiograms (EKGs) separated by at least 3 minutes should be performed; if the average of these three consecutive results for QTcF is =< 500 ms, the subject meets eligibility in this regard","False:The subject is unable or unwilling to abide by the study protocol or cooperate fully with the investigator or designee","False:The subject has had evidence within 2 years of the start of study treatment of another malignancy which required systemic treatment","False:Patients should not have any clinical evidence of an active infection at the time of enrollment","measurement:affirmed;"
