"NCI-2009-00336","True:Newly diagnosed, previously untreated: (1) M0 medulloblastoma with > 1.5 cm^2 residual; (2) M+ medulloblastoma; patients with diffusely anaplastic medulloblastoma are eligible regardless of M-stage or residual tumor* As of amendment # 2, enrollment of patients with supratentorial PNET has been discontinued* All patients with M4 disease are not eligible","True:A pre-operative magnetic resonance imaging (MRI) scan of the brain with and without contrast is required; NOTE: computed tomography (CT) scans are NOT sufficient for study eligibility* Post-operative head MRI scan with and without contrast (preferably within 72 hours post-surgery); for patients who undergo stereotactic biopsy only, either a pre or post-operative MRI is sufficient; for patients with M2 and M3 disease, a post-op MRI is strongly encouraged, but not mandatory* Spinal MRI imaging with and without gadolinium is required within 10 days of surgery if done pre-operatively or within 28 days of surgery if done post-operatively; for posterior fossa tumors, pre-operative MRI scans are preferred","True:Lumbar cerebrospinal fluid (CSF) cytology examination must be obtained pre-operatively or within 31 days following surgery; the optimal time for obtaining CSF is prior to surgery or 1-3 weeks following surgery; ventricular CSF (either pre- or post-op) may be used only if a post-operative spinal tap is contraindicated; if a spinal tap is contraindicated and there is no ventricular CSF available, then CSF cytology can be waived for patients with supratentorial tumors or if there is documentation of spinal subarachnoid metastases (M3); patients who are categorized as M1 must have either an intra-operative positive CSF (via lumbar puncture at the end of the procedure) or a positive lumbar CSF obtained > 7 days post-operatively","True:Patients must have a Karnofsky performance level of >= 30 for patients > 16 years of age or a Lansky performance scale of >= 30 for patients =< 16 years of age and life expectancy > 8 weeks","True:No previous chemotherapy or radiation therapy","True:Corticosteroids should not be used during chemotherapy administration as an antiemetic","True:Selected strong inhibitors of cytochrome P450, family 3, subfamily A, polypeptide 4 (cytochrome P450 3A4) include azole antifungals, such as fluconazole, voriconazole, itraconazole, ketoconazole, and strong inducers include drugs such as rifampin, phenytoin, phenobarbitol, carbamazepine, and St. John’s wort; the use of these drugs should be avoided with vincristine (vincristine sulfate)","True:CYP450 3A4 stimulators or inhibitors should be avoided or used with great caution when taking cyclophosphamide; aprepitant should also be used with caution with etoposide or vincristine chemotherapy","True:Cisplatin should be used with caution with nephrotoxic drug; aminoglycoside should be avoided or used with caution during or shortly after cisplatin administration and concomitant use with amphotericin B should probably also be avoided; patients receiving cisplatin and other potentially ototoxic drugs such as aminoglycoside or loop diuretics concomitantly should be closely monitored for signs of ototoxicity* Plasma levels of anticonvulsant agents should be monitored and doses adjusted during therapy with cisplatin","True:No other experimental therapy is permitted while on study","True:Creatinine clearance or radioisotope glomerular filtration rate (GFR) >= 70 mL/min/1.73 m^2 OR a serum creatinine based on age/gender as follows:            * 0.8 mg/dL (2 to < 6 years of age)* 1.0 mg/dL (6 to < 10 years of age)* 1.2 mg/dL (10 to < 13 years of age)* 1.5 mg/dL (male) or 1.4 mg/dL (female) (13 to < 16 years of age)* 1.7 mg/dL (male) or 1.4 mg/dL (female) (>= 16 years of age)","True:Total bilirubin < 1.5 x upper limit of normal (ULN) for age","True:Serum glutamic oxaloacetic transaminase (SGOT) (aspartate aminotransferase [AST]) or serum glutamate pyruvate transaminase (SGPT) (alanine aminotransferase [ALT]) < 2.5 x upper limit of normal (ULN) for age; for patients on anti-seizure medications, SGOT (AST) or SGPT (ALT) must be < 5 x ULN","True:Absolute neutrophil count (ANC) >= 1,000/uL","True:Platelets >= 100,000/uL (untransfused)","True:Hemoglobin >= 8 g/dl (may be transfused)","True:Female patients who are post-menarchal must have a negative pregnancy test; lactating female patients must agree not to breast-feed while on this trial; males or females of reproductive potential may not participate unless they have agreed to use an effective contraceptive method","True:All patients and/or their parents or legal guardians must sign a written informed consent","True:All institutional, Food and Drug Administration (FDA), and National Cancer Institute (NCI) requirements for human studies must be met","measurement:affirmed;measurement:affirmed;measurement:affirmed;measurement:affirmed;measurement:affirmed;"
"NCI-2009-00470","True:Histologically or cytologically confirmed small cell lung cancer","True:Limited stage disease patients, with disease restricted to one hemithorax with regional lymph node metastases, including ipsilateral hilar, ipsilateral and contralateral mediastinal, and ipsilateral supraclavicular lymph nodes* Patients with disease involvement of the contralateral hilar or supraclavicular lymph nodes are not eligible* Patients with pleural effusions that are visible on plain chest radiographs, whether cytologically positive or not, are not eligible unless they have a negative thoracentesis* Patients with cytologically positive pleural or pericardial fluid, regardless of the appearance on plain x-ray, are not eligible","True:Patients must have measurable disease, which includes lesions that can be accurately measured in at least one dimension (longest diameter to be recorded) as >= 2 cm with conventional techniques or as >= 1 cm with spiral computed tomography (CT) scan","True:Patients may have received one and only one cycle of chemotherapy prior to enrolling on Cancer and Leukemia Group B (CALGB) 30610, which must have included carboplatin or cisplatin and etoposide; if a patient has had one cycle of cisplatin (or carboplatin)/etoposide prior to registration, the patient must have had all of the prior to registration tests prior to starting their first cycle of chemotherapy; additionally, these patients also must have met all of the eligibility criteria prior to receiving the first cycle of chemotherapy; registration to CALGB 30610 must take place within 7-21 days after the start of the non-protocol therapy; failing to do all of the above will make the patient NOT eligible for CALGB 30610","True:No prior radiotherapy or chemotherapy (except for the chemotherapy described in the bullet above) for small cell lung cancer (SCLC)","True:No prior mediastinal or thoracic radiotherapy","True:Patients with complete surgical resection of disease are not eligible","True:Eastern Cooperative Oncology Group (ECOG) performance status (PS) = 0-2","True:No patients that are known to be pregnant or nursing","True:Granulocytes >= 1,500/ul","True:Platelet count >= 100,000/ul","True:Total bilirubin =< 1.5 x upper limit of normal (ULN)","True:Aspartate aminotransferase (AST) (serum glutamic oxaloacetic transaminase [SGOT]) =< 2.0 x ULN","True:Serum creatinine =< 1.5 times ULN OR calculated creatinine clearance >= 70 mL/min",""
"NCI-2009-00595","True:Patients with a histological diagnosis of epithelial ovarian cancer, fallopian tube or primary peritoneal carcinoma, clinical stage II, III or IV at diagnosis","True:Patients with the following histologic epithelial cell types are eligible: serous adenocarcinoma, endometrioid adenocarcinoma, mucinous adenocarcinoma, undifferentiated carcinoma, clear cell adenocarcinoma, mixed epithelial carcinoma, transitional cell carcinoma, malignant Brenner’s tumor or adenocarcinoma not otherwise specified (N.O.S.); however, the histologic features of the tumor must be compatible with a primary Müllerian epithelial adenocarcinoma","True:Patients must have completed all primary chemotherapy and consolidation therapy (if administered) at least 6 weeks, and no more than 6 months and 2 weeks, prior to enrollment and must be in complete remission; consolidation therapy is defined as any chemotherapy or biological therapy used for a patient who has completed at least four courses of primary chemotherapy and had documented complete remission prior to initiation of such chemotherapy (chemo) or biological therapy","True:Patients must have achieved a documented complete response to treatment based on normal cancer antigen (CA)-125 (per the institution’s upper limit of normal) and computed tomography (CT) scan or magnetic resonance imaging (MRI) with contrast (i.e. there must be no clinical evidence of persistent or recurrent disease based on CA-125 and CT scan or MRI with contrast)","True:Patients must have a Gynecologic Oncology Group (GOG) performance grade of 0, 1, or 2","True:Patients must not be currently enrolled in an ongoing (participating for 6 months or longer) medically prescribed diet or physical activity regimen","True:Patients must have no other chronic disease that would preclude randomization into a lifestyle intervention trial; such diseases include recent myocardial infarction or unstable angina (in the previous 6 months), chronic hepatitis, rheumatoid disease, renal or hepatic disease/dysfunction and diabetics receiving insulin; or other clinical condition limiting ability to walk (recent leg fracture, significant osteoarthritis, related orthopedic conditions, degenerative neurological conditions, etc.)","True:Patients must not have a serious psychiatric illness (e.g. lifetime bipolar disorder, schizophrenia or other psychosis, serious personality disorder, severe major depressive disorder or recent suicide or psychiatric hospitalization) (previous 12 months), or a history of an eating disorder (anorexia nervosa or bulimia nervosa)","True:Patients must complete all pre-entry assessments","True:Patients must have signed an approved informed consent and authorization permitting release of personal health information","True:Patients must be willing to provide name and appropriate telephone contact information and be willing to be contacted periodically via telephone by The University of Arizona Cancer Center (AZCC) staff for completion of individualized lifestyle intervention coaching, completion of the Pittsburgh Sleep Quality Index, and for clarification of patient-completed responses if necessary; patient must be willing to have Arizona Food Frequency Questionnaire (AFFQ), Arizona Physical Activity Questionnaire (APAQ), baseline questionnaire, and personal contact information sent to AZCC","False:Patients with GOG performance grade of 3 or 4","False:Patients may not have a history of other invasive malignancies within the last five years, with the exception of non-melanoma skin cancer or stage 1A endometrioid adenocarcinoma of the uterus","False:Patients diagnosed with chronic disease/illness precluding their participation (i.e., diabetics receiving insulin, myocardial infarction or unstable angina within previous 6 months, chronic hepatitis, rheumatoid disease, renal or hepatic disease/dysfunction)","False:Patients with a histological diagnosis of clinical stage I epithelial ovarian cancer, fallopian tube or primary peritoneal carcinoma","False:Patients who are currently undergoing treatment (primary or consolidation) for stage II, III or IV ovarian, fallopian tube or primary peritoneal cancer or who completed treatment less than six weeks ago","False:Patients with a life expectancy of less than one year","False:Patients with body mass index (BMI) < 20 kg/m^2","False:Vegan vegetarians","False:Patients enrolled in a weight loss program or who are taking weight loss medications or dietary supplements and are unwilling to discontinue","False:Patients who have participated in a marathon, triathlon, or other endurance-related physical activity within the previous 24 months","False:Patients who have had surgery for weight loss* Note: women will not be excluded if their baseline lifestyle assessment indicates a healthy eating and moderate physical activity with the exception of the exclusion criteria above",""
"NCI-2009-00603","True:All patients must have undergone complete hysterectomy and bilateral salpingo-oophorectomy at the time of original therapy for their uterine carcinoma","True:Patients must have a biopsy with histologically confirmed diagnosis of recurrent endometrial cancer confined to the pelvis and/or vagina and no evidence of extrapelvic disease","True:Patients must have endometrial carcinoma including endometrioid adenocarcinoma, adenocarcinoma with squamous differentiation, mucinous adenocarcinoma, squamous cell carcinoma, mixed carcinoma, undifferentiated carcinoma, clear cell adenocarcinoma, and serous adenocarcinoma histologies","True:Patients must have no evidence of extrapelvic disease; complete workup staging should be performed prior to initiation of therapy to rule-out presence of metastatic disease; this should include: computed tomography (CT) scan of the thorax with IV contrast, as well as a CT of the pelvis and abdomen with IV and oral (PO) contrast performed using multi-detector CT and equal or less than 5 mm slice thickness; if the patient is unable to tolerate contrast, then magnetic resonance imaging (MRI) with IV gadolinium should be performed; a chest x-ray should be done first, and if abnormal, then a CT scan of the chest should be done","True:Primary surgical debulking before protocol therapy is permissible; this would include removal of gross symptomatic disease in the pelvis and/or vagina* Exenterative surgery is not permissible; patients with complete resection of gross recurrent disease are eligible","True:Patients may have received prior hormone therapy and/or systemic chemotherapy; such therapy must have been completed at least 6 months prior to study entry and the patient has clear evidence of disease subsequent to such therapy; patients must not have received neoadjuvant chemotherapy for the present recurrent disease","True:Patients must have Gynecologic Oncology Group (GOG) performance status 0, 1, or 2","True:Patients must have an estimated survival greater or equal to 3 months","True:Absolute neutrophil count (ANC) >= 1,500/mm^3 , equivalent to Common Toxicity Criteria (Common Terminology Criteria for Adverse Events [CTCAE] version [v] 3.0) grade 1","True:Platelets >= 100,000/mm^3, equivalent to CTCAE v 3.0 grade 0-1","True:Creatinine =< institutional upper limit normal (ULN), CTCAE v 3.0 grade 0; NOTE: if creatinine > ULN, creatinine clearance must be > 50 mL/min","True:Bilirubin =< 1.5 x ULN (CTCAE v 3.0 grade 1)","True:Serum glutamic oxaloacetic transaminase (SGOT) =< 2.5 x ULN (CTCAE v 3.0 grade 0-1)","True:Alkaline phosphatase =< 2.5 x ULN (CTCAE v 3.0 grade 0-1)","True:Neuropathy (sensory and motor) =< CTCAE v 3.0 grade 1","True:Patients with ureteral obstruction must undergo stent or nephrostomy tube placement prior to study entry","True:Patients who have met the pre-entry requirements","True:Patients must have signed an approved informed consent and Health Insurance Portability and Accountability Act (HIPAA) authorization","False:Patients with evidence of disease outside of the pelvis, including presence of positive periaortic or inguino-femoral nodes","False:Patients who have received previous vaginal, pelvic, or abdominal irradiation","False:Patients who received chemotherapy directed at the present recurrence","False:Patients with septicemia or severe infection","False:Patients who have circumstances that will not permit completion of this study or the required follow-up","False:Patients with renal abnormalities, such as pelvic kidney, horseshoe kidney, or renal transplantation, that would require modification of radiation fields","False:Patients with a history of other invasive malignancies, with the exception of non-melanoma skin cancer, are excluded if there is any evidence of other malignancy being present within the last five years; patients are also excluded if their previous cancer treatment contraindicates this protocol therapy","False:Patients who have undergone complete surgical resection of the recurrent tumor and have no evidence of residual disease evaluable clinically and by CT or MRI imaging, following resection","False:Patients who have a significant history of cardiac disease, i.e., uncontrolled hypertension, unstable angina, congestive heart failure, or uncontrolled arrhythmias within 6 months of registration","False:Patients with history of active collagen vascular disease","False:Patients with GOG performance grade of 3 or 4","measurement:affirmed;measurement:affirmed;"
"NCI-2009-00817","True:Non-Hodgkin's lymphomas in the following categories: mediastinal gray zone lymphoma and primary mediastinal B cell lymphoma","True:Diagnosis confirmed by staff of the Hematopathology Section, Laboratory of Pathology, National Cancer Institute (NCI)","True:Any stage for mediastinal gray zone lymphoma (MGZL) and primary mediastinal B cell lymphoma (PMBL)","True:No prior systemic chemotherapy; patients may be entered if they have had prior limited-field radiotherapy, a short course of glucocorticoids and/or cyclophosphamide for an urgent problem at diagnosis (e.g. epidural cord compression, superior vena cava syndrome)","True:Human immunodeficiency virus (HIV) negative","True:Not pregnant or nursing","True:In adults: serum creatinine =< 1.5 mg/dl or creatinine clearance > 60 ml/min; and in children serum creatinine (Cr) =< age-adjusted normal* Age 12-15 years: 1.2 mg/dl* Age > 15 years: 1.5 mg/dl","True:Bilirubin < 1.5 mg/dl","True:Absolute neutrophil count (ANC) > 1000 unless impairment is due to lymphoma or immune-mediated mechanism caused by lymphoma","True:Platelets > 100,000 unless impairment is due to lymphoma or immune-mediated mechanism caused by lymphoma","True:No active symptomatic ischemic heart disease, myocardial infarction or congestive heart failure within the past year; if multi gated acquisition (MUGA) is obtained, the left ventricular ejection fraction (LVEF) should exceed 40%","True:No other serious concomitant medical illnesses or uncontrolled active infection that would jeopardize the patient's ability to receive the regimen with reasonable safety","True:No history of unrelated (non-lymphomatous) neoplasms within past 5 years other than non-melanoma skin cancer or in-situ cancer","True:Ability to give informed consent","c15220:affirmed;"
"NCI-2009-01057","True:Patients must have histologically or cytologically confirmed diagnosis of malignancy that is metastatic or unresectable and for which standard curative or palliative measures do not exist or are no longer effective or for whom CPT-11 treatment would be a viable therapy regimen; patients with solid hematologic malignancies (Hodgkin’s and non-Hodgkin’s lymphomas) may be included as long as a bone marrow has been performed within 6 weeks of treatment","True:Patients enrolled on the expansion portion of the study will consist of two cohorts: those patients who are triple-negative, BRCA-mutant positive and those patients who have triple-negative, non-BRCA mutated breast cancer","True:Patients enrolled on the dose escalation for intermittent ABT-888 portion of the study must histologically or cytologically confirmed diagnosis of malignancy that is metastatic or unresectable and for which standard curative or palliative measures do not exist or are no longer effective or for whom CPT-11 treatment would be a viable therapy regimen; patients with solid hematologic malignancies (Hodgkin’s and non-Hodgkin’s lymphomas) may be included as long as a bone marrow has been performed within 6 weeks of treatment","True:Patient must have measurable disease per Response Evaluation Criteria in Solid Tumors (RECIST) guidelines","True:Patients must have tumors determined to be easily accessible for biopsy (e.g. pleural-based lesions, peripheral lymph nodes, soft tissue metastases, large liver metastases, etc)","True:Prior chemotherapy is allowed; patients must not have received chemotherapy for 4 weeks prior to the initiation of study treatment and must have full recovery from any acute effects of any prior chemotherapy; patients must not have had nitrosoureas or mitomycin C for 6 weeks prior to the initiation of study treatment","True:Prior radiation therapy is allowed; patients must not have received minimal radiation therapy (=< 5% of their total marrow volume) within 3 weeks prior to the initiation of study treatment; otherwise, patients must not have received radiation therapy (> 5% of their total marrow volume) within 4 weeks prior to the initiation of study treatment; patients who have received prior radiation to 50% or more of their total marrow volume will be excluded","True:Prior experimental (non-Food and Drug Administration [FDA] approved) therapies and immunotherapies are allowed; patients must not have received these therapies for 4 weeks prior to the initiation of study treatment and must have full recovery from any acute effects of these therapies","True:Eastern Cooperative Oncology Group (ECOG) performance status =< 2 (Karnofsky >= 60%)","True:Life expectancy of greater than 12 weeks","True:Absolute neutrophil count (ANC) >= 1,500/mcL","True:Platelets (PLT) >= 100,000/mcL","True:Aspartate aminotransferase (AST) and alanine aminotransferase (ALT) =< 2.5 x upper limit of normal (ULN); if liver metastases are present, =< 5 x ULN","True:Bilirubin =< 1.5 x ULN","True:Creatinine =< 1.5 x ULN OR calculated or measured creatinine clearance >= 60 mL/min/1.73 m^2 for patients with creatinine above institutional normal","True:Women of child-bearing potential and men must agree to use adequate contraception (hormonal or barrier method of birth control; abstinence) prior to study entry, for the duration of study participation, and for three months following completion of study therapy; should a woman become pregnant or suspect she is pregnant while participating in this study, she should inform her treating physician immediately","True:Ability to understand and the willingness to sign a written informed consent document","True:All patients must provide archival tissue block or paraffin sample from archival tissue block (approximately 10 sections) for use in pharmacodynamic correlative studies (NOT required for patients enrolled on the dose escalation for intermittent ABT-888 portion of the study)","False:Patients who have had chemotherapy or radiotherapy within 4 weeks (6 weeks for nitrosoureas or mitomycin C) prior to entering the study or those who have not recovered from adverse events due to agents administered more than 4 weeks earlier; patients who have been administered ABT-888 as part of a single or limited dosing study, such as a phase 0 study, should not necessarily be excluded from participating in this study solely because of receiving prior ABT-888","False:Patients may not have received any other investigational agents within 4 weeks of study entry","False:History of allergic reactions attributed to the following: * Camptothecin derivatives (e.g., topotecan [topotecan hydrochloride], irinotecan, or exatecan [exatecan mesylate]) * Any ingredients contained within the liquid irinotecan solution (e.g., sorbitol) or* Any antiemetics or antidiarrheals appropriate for administration with study therapy (e.g., loperamide or dexamethasone)","False:Patients must not receive any other anti-cancer therapy (cytotoxic, biologic, radiation, or hormonal other than for replacement) while on this study except for medications that are prescribed for supportive care but may potentially have an anti-cancer effect (i.e. megestrol acetate, bisphosphonates); these medications must have been started 1 month prior to enrollment on this study; in addition, men receiving treatment for prostate cancer will be maintained at castrate levels of testosterone by continuation of luteinizing-releasing hormone agonists","False:Patients with uncontrolled seizures","False:Patients with known active brain metastases should be excluded from this clinical trial; patients with prior treated brain metastases are allowed, providing that they were not accompanied by seizures and that a baseline brain magnetic resonance imaging (MRI) scan prior to study entry demonstrates no current evidence of brain metastases; all patients with central nervous system (CNS) metastases must be stable for > 3 months after treatment and off steroid treatment prior to study enrollment","False:Any patient requiring chronic maintenance of white blood cell counts or granulocyte counts through the use of growth factor support (e.g. Neulasta, Neupogen)","False:Any patient requiring cytochrome P450 family 3, subfamily A, polypeptide 4 (CYP3A4) isoform-inducing drugs (e.g. phenytoin, phenobarbital, carbamazepine, rifampin, rifabutin, ketoconazole, St. John’s wort) will be excluded; CYP3A4-inducing drugs should be discontinued at least 2 weeks prior to the first cycle of irinotecan","False:Uncontrolled intercurrent illness including, but not limited to: * Ongoing or active infection* Symptomatic congestive heart failure* Unstable angina pectoris* Cardiac arrhythmia or* Psychiatric illness or social situations that would limit compliance with study requirements","False:Pregnant women are excluded from this study; breastfeeding should be discontinued if the mother is treated with ABT-888","False:Patients who are unable to reliably tolerate and/or receive oral medications",""
