"NCI-2011-02500","True:Patients must have histologically confirmed malignancy that is radiologically evaluable and metastatic or unresectable, for which standard curative or palliative measures do not exist or are no longer effective, and for which there is expectation of response to the combination of carboplatin/paclitaxel (i.e., lung, ovarian, breast, melanoma, head and neck, endometrial, urothelial, testicular, esophageal, carcinoma of unknown primary); for indications not listed, eligibility based on disease must be verified by the principal investigator before they are considered","True:Eastern Cooperative Oncology Group (ECOG) performance status =< 2 (Karnofsky >= 60%)","True:Life expectancy of greater than 12 weeks","True:Absolute neutrophil count >= 1,500/mcL","True:Platelets >= 100,000/mcL","True:Hemoglobin >= 8.0 g/dL","True:Patients with all degrees of renal dysfunction are allowed including patients on hemodialysis; patients with mild to severe hepatic dysfunction are allowed as defined below:","True:Total bilirubin =< 5 x upper limit of normal (ULN)","True:Aspartate aminotransferase (AST) and alanine aminotransferase (ALT) =< 10 x ULN","True:For patients with a recently placed biliary stent, patients should have consistent results within a hepatic group from two laboratory readings within 3 days apart, taken at least 10 days following biliary stent placement; for patients with a biliary stent placed over 2 months ago, no obstruction or blockage can have occurred within the last 2 months","True:Women of child-bearing potential and men must agree to use adequate contraception (hormonal or barrier method of birth control; abstinence) prior to study entry and for the duration of study participation; should a woman become pregnant or suspect she is pregnant while participating in this study, she should inform her treating physician immediately","True:Ability to understand and the willingness to sign a written informed consent document","False:Patients who have had chemotherapy or radiotherapy within 4 weeks (6 weeks for nitrosoureas or mitomycin C) prior to entering the study or those whose adverse event due to agents administered more than 4 weeks earlier have not resolved or stabilized; patients who have been administered ABT-888 as part of a single or combination, phase 0 or I study, should not necessarily be excluded from participating in this study solely because of receiving prior ABT-888","False:Patients may not be receiving any other investigational agents","False:History of allergic reactions attributed to compounds of similar chemical or biologic composition to ABT-888 or other agents used in study","False:Peripheral neuropathy of severity greater than grade 1","False:Inability to take oral medications on a continuous basis","False:Evidence of bleeding diathesis","False:Patients with central nervous system (CNS) metastases must be stable after therapy for CNS metastases (such as surgery, radiotherapy or stereotactic radiosurgery) for at least 3 months and must be off steroid treatment prior to study enrollment","False:Uncontrolled intercurrent illness including, but not limited to, ongoing or active infection, symptomatic congestive heart failure, unstable angina pectoris, cardiac arrhythmia, or psychiatric illness/social situations that would limit compliance with study requirements","False:Pregnant women are excluded from this study; breastfeeding should be discontinued if the mother is treated with ABT-888; these potential risks may also apply to other agents used in this study","False:Human immunodeficiency virus (HIV)-positive patients on combination antiretroviral therapy are ineligible; however, HIV-positive patients without an acquired immune deficiency syndrome (AIDS)-defining diagnosis who are not receiving agents with the potential for pharmacokinetic (PK) interactions with ABT-888 may be eligible","False:Patients with both hepatic and renal dysfunction will also be excluded","False:Patients who received and progressed on the combination of carboplatin/paclitaxel will not be eligible","False:Active seizure or history of seizure disorder",""
"NCI-2011-02515","True:Patients must have histologically documented (confirmed at the Laboratory of Pathology, National Cancer Institute [NCI]), relapsed solid tumor malignancy or Hodgkin's disease/non-Hodgkin lymphoma that is metastatic or unresectable for which standard curative measures do not exist, or are associated with minimal patient survival benefit","True:Patients must have measurable or evaluable disease","True:Patients must have recovered to at least eligibility levels due to adverse events (AEs) and/or toxicity of prior chemotherapy or biologic therapy; they must not have had chemotherapy or biologic therapy within 4 weeks (6 weeks for nitrosoureas and mitomycin C, or 2 months for UCN-01), or therapy with tyrosine kinase inhibitors within 5 times the half-life of the inhibitors prior to entering the study; patients must be >= 2 weeks since any investigational agent administered as part of a phase 0 study (also referred to as an “early phase I study” or “pre-phase I study” where a sub-therapeutic dose of drug is administered) at the principal investigator's (PI) discretion, and should have recovered to eligibility levels from any toxicities","True:Patients must have recovered to at least a grade =< 1 toxicity eligibility levels due to adverse events (AEs) and/or toxicity of prior chemotherapy or biologic therapy; they must not have had chemotherapy or biologic therapy within 4 weeks (6 weeks for nitrosoureas and mitomycin C, or 2 months for UCN-01), or therapy with tyrosine kinase inhibitors within 5 times the half-life of the inhibitors prior to entering the study; patients must be >= 2 weeks since any prior administration of study drug in an exploratory investigational new drug (IND)/phase 0 study; patients must be >= 1 month since completion of any prior radiation (>= 2 weeks for palliative radiation therapy); however, patients receiving bisphosphonates for any cancer or undergoing androgen deprivation therapy for prostate cancer are eligible for this therapy* Prior therapy with topoisomerase I inhibitors is allowed","True:The Eastern Cooperative Oncology Group (ECOG) performance status =< 2 (Karnofsky >= 60 %)","True:Life expectancy > 3 months","True:Absolute neutrophil count (ANC) >= 1,500/uL","True:Platelet count >= 100,000/uL","True:Total bilirubin within =< 1.5 normal institutional limits (patients with Gilbert’s syndrome with total bilirubin up to 2.5 mg/dL is allowed)","True:Aspartate aminotransferase (AST) (serum glutamic oxaloacetic transaminase [SGOT])/alanine aminotransferase (ALT) (serum glutamate pyruvate transaminase [SGPT]) =< 2.5 x institutional upper limit of normal (ULN)","True:Creatinine < 1.5 x ULN OR creatinine clearance measured >= 60 mL/minute for patients with creatinine levels >= 1.5 x upper limit of normal","True:Women of child-bearing potential and men must agree to use adequate contraception (hormonal or barrier method of birth control or abstinence) prior to study entry, for the duration of study participation, and for 2 months after discontinuation from the study; women of child bearing potential must have a negative pregnancy test in order to be eligible; should a woman become pregnant or suspect she is pregnant while participating in this study, she should inform her treating physician immediately","True:Breastfeeding should be discontinued if the mother is treated with indenoisoquinolines","True:At the point when tumor biopsies become mandatory (expansion phase only), disease amenable to biopsy and willingness to undergo biopsies or patient will be undergoing a procedure due to medical necessity during which the tissue may be collected, or tumor biopsy tissue from a previous research study or medical care is available for submission at registration; criteria for the submission of tissue are:* Tissue must have been collected within 3 months prior to registration* Patient has not received any intervening therapy for their cancer since the collection of the tumor sample* Tumor tissue must meet the minimum requirements outlined","True:Ability to understand and the willingness to sign a written informed consent document","False:Patients receiving any other investigational agents","False:Patients with known brain metastases are excluded from this clinical trial, with the exception of patients whose brain metastatic disease status has remained stable for >= 2 months after treatment of the brain metastases, without steroids or anti-seizure medications; these patients may be enrolled at the discretion of the principal investigator","False:Patients with clinically significant illnesses which could compromise participation in the study, including, but not limited to, active or uncontrolled infection, immune deficiencies, known human immunodeficiency virus (HIV) infection requiring antiretroviral therapy, hepatitis B, hepatitis C, uncontrolled diabetes, uncontrolled hypertension, symptomatic congestive heart failure, unstable angina pectoris, myocardial infarction within the past 6 months, uncontrolled cardiac arrhythmia, or psychiatric illness/social situations that would limit compliance with study requirements","measurement:affirmed;measurement:affirmed;measurement:affirmed;measurement:affirmed;"
"NCI-2011-02539","True:Histological confirmation of a high-grade malignant glioma is required; histologic diagnoses include, but are not limited to, anaplastic astrocytoma and glioblastoma multiforme; patients with DIPG are exempt from histologic verification if they have typical MRI findings of DIPG (i.e. hypo- or isointense on T1-weighted imaging, hyperintense on fluid-attenuated inversion recovery [FLAIR] or T2-weighted imaging, epicenter in the pons, > 50% of pons involved) in the face of a typical clinical presentation","True:Inoperable tumor or residual disease after resection","True:No prior chemotherapy or radiation therapy for HGG or DIPG is permitted; prior chemotherapy or radiation therapy for treatment of other malignancies is permitted","True:Able to swallow whole capsules","True:Patients should have a Karnofsky/Lansky score of greater than or equal to 60; patients who require special assistance due to tumor-related paralysis, but who are out of bed during the day will be considered ambulatory for the purpose of calculating the performance score; patients must be able to communicate any symptoms","True:Absolute neutrophil count >= 1,000/mcL assessed within seven (7) days prior to the start of therapy","True:Platelets >= 100,000/mcL assessed within seven (7) days prior to the start of therapy","True:Total bilirubin < 1.5 x upper limit of normal assessed within seven (7) days prior to the start of therapy","True:Aspartate aminotransferase (AST) (serum glutamic oxaloacetic transaminase [SGOT])/alanine aminotransferase (ALT) (serum glutamate pyruvate transaminase [SGPT]) =< 2.5 x institutional upper limit of normal assessed within seven (7) days prior to the start of therapy","True:Creatinine below age-adjusted maximum limits in the table below OR creatinine clearance >= 60 mL/min/1.73 m^2 assessed within seven (7) days prior to the start of therapy* 0.8 mg/dl (patients =< 5 years of age)* 1.0 mg/dl (patients 5 < age =< 10 years of age)* 1.2 mg/dl (patients 10 < age =< 15 years of age)* 1.5 mg/dl (patients > 15 years of age)","True:Females only:* Urine or serum pregnancy test negative assessed within seven (7) days prior to the start of therapy","True:No overt renal, hepatic, cardiac or pulmonary disease","True:Newly diagnosed patients may need to be on steroids due to surgery or control of neurologic symptoms; patients on steroids postoperatively or for control of tumor-related edema are eligible, but attempts to keep patients on the lowest dose necessary to control symptoms should be made","True:This protocol defines a female of childbearing potential (FCCBP) as a sexually mature female (at least Tanner 2) who: 1) has not undergone a hysterectomy or bilateral oophorectomy or 2) has not been naturally postmenopausal (amenorrhea following cancer therapy does not rule out childbearing potential) for at least 24 consecutive months (i.e., has had menses at any time in the preceding 24 consecutive months)* Criteria for female children of childbearing potential (FCCBP)** This protocol defines FCCBP as females who have:*** Achieved menarche and/or breast development in Tanner stage 2 or greater*** Has not undergone a hysterectomy or bilateral oophorectomy; *** Note: amenorrhea following cancer therapy does not rule out childbearing potential* Criteria for female children not of childbearing potential (FCBCBP)** This protocol defines FCNCBP as females:*** Who have not yet experienced menarche or breast development in Tanner stage 2*** Who have undergone a hysterectomy or bilateral oophorectomy* Females of childbearing potential (FCBP) must have a negative serum or urine pregnancy test with a sensitivity of at least 25 mIU/mL within 10 – 14 days and again within 24 hours prior to starting course 1 of lenalidomide; further, they must either commit to continued abstinence from heterosexual intercourse or begin TWO acceptable methods of birth control: one highly effective method and one additional effective method AT THE SAME TIME, at least 28 days before starting lenalidomide; FCBP must also agree to ongoing pregnancy testing; men must agree to use a latex condom during sexual contact with a FCBP, even if they have had a successful vasectomy; a FCBP is a sexually mature female (Tanner stage 2) who: 1) has not undergone a hysterectomy or bilateral oophorectomy; or 2) has not been naturally postmenopausal for at least 24 consecutive months (i.e., has had menses at any time in the preceding 24 consecutive months); all patients must be counseled by a trained counselor every 28 days about pregnancy precautions and risks of fetal exposure* Male subjects** Appropriate male subjects (i.e. those who have reached puberty and are sexually active) will be counseled regarding birth control methods; they must agree to use a latex condom during sexual contact with females of childbearing potential while participating in the study and for at least 28 days following discontinuation from the study even if he has undergone a successful vasectomy** Appropriate male patients will be given a reproductive risks handout and counseled by a provider; for sexually active patients, the counseling session, consent and counseling checklist will be documented monthly","True:All patients or their legal guardians (if the patient is < 18 years old) or durable power of attorney (DPA) must sign a document of informed consent indicating their understanding of the investigational nature and the risks of this study; when appropriate, pediatric patients will be included in all discussions in order to obtain verbal assent","True:Assignment of DPA to a family member or guardian should be offered to all patients 18 years of age or older","True:Signed informed consent according to institutional guidelines must be obtained","False:Patients who have had prior chemotherapy for this tumor","False:Patients with an HGG that was completely resected with good margins","False:Patients with a body surface area (BSA) =< 0.4 m^2 are excluded","False:Patients with a known coagulation disorder are excluded; patients with a first-degree relative with a history of venous thrombosis before age 50 years (yrs) or an arterial thrombosis before age 40 yrs must have the following testing performed prior to enrollment to exclude a heritable disorder; patients with a suspected disorder will be excluded","False:Patients who have had a thromboembolic event that is not line-related are excluded","False:Patients with any significant medical illnesses that, in the investigator's opinion, cannot be adequately controlled with appropriate therapy, would compromise a patient's ability to tolerate this therapy or result in inability to assess toxicity; this includes, but is not limited to uncontrolled intercurrent illness including ongoing or active infection, cardiac disease, renal impairment or psychiatric illness/social situations that would limit compliance with study requirements","False:Patients with a history of toxic epidermal necrolysis (TEN) or Stevens-Johnson syndrome are excluded","False:Patients receiving any other investigational agents","False:History of allergic reactions attributed to compounds of similar chemical or biologic composition to lenalidomide (i.e. thalidomide)","False:Patients with known hypersensitivity to anhydrous lactose, microcrystalline cellulose, croscarmellose sodium, and magnesium stearate","False:Pregnant women are excluded from this study; breastfeeding should be discontinued if the mother is treated with lenalidomide","False:Known human immunodeficiency virus (HIV)-positive patients on combination antiretroviral therapy are ineligible","False:Patients identified as needing spinal radiation at diagnosis (e.g. spinal metastasis or malignant cells identified on cerebrospinal fluid [CSF] cytology) are excluded",""
"NCI-2011-02592","True:Patients must have histologically or cytologically-proven new diagnosis of unresectable stage IIIA/IIIB*, non-small cell lung cancer (adenocarcinoma, bronchioloalveolar cell carcinoma, large cell carcinoma, squamous cell carcinoma, or mixed)* Per the American Joint Committee on Cancer (AJCC) 7th edition, pleural and pericardial are now considered stage M1a disease; when pleural fluid is visible on the computed tomography (CT) scan or on a chest x-ray, a thoracentesis is required to confirm that the pleural fluid is cytologically negative; patients with exudative pleural effusions are excluded, regardless of cytology; patients with effusions that are minimal (i.e. not visible on chest x-ray) that are too small to safely tap are eligible; a small effusion that has positive fludeoxyglucose F 18 (FDG) uptake on positron emission tomography (PET) has to be proven to be malignant per standard of care diagnostic procedures for the patient to be excluded","True:Patients must have measurable or non-measurable disease documented by CT, magnetic resonance imaging (MRI) or PET/CT; the CT from a combined PET/CT may be used to document only non-measurable disease unless the scan is of diagnostic quality; measurable disease must be assessed by CT within 28 days prior to registration; pleural effusions, ascites and laboratory parameters are not acceptable as the only evidence of disease; non-measurable disease must be assessed within 42 days prior to registration; all disease must be assessed and documented on the Baseline Tumor Assessment Form","True:Patients with brain metastases are ineligible; all patients must have a pretreatment CT or MRI scan of the brain to evaluate for central nervous system (CNS) disease within 42 days prior to registration","True:Patients must not have received any prior systemic therapy (chemotherapy or other biologic therapy) for lung cancer","True:Patients must not have received prior chest radiation therapy for NSCLC","True:Patients must not have had a previous surgical resection; however, patients may have undergone exploratory thoracotomy, mediastinoscopy, excisional biopsy or similar surgery for the purpose of determining the diagnosis, stage or potential resectability of newly diagnosed lung tumor; at least 28 days must have elapsed since thoracic surgery (excluding mediastinoscopy or other minor surgeries) and patients should have recovered from all associated toxicities at the time of registration; patients must not be planning to undergo a minor surgical procedure while on this study","True:Patients must have Zubrod performance status 0-1","True:Patients must have tumor tissue available for submission to assess gene expression of ERCC1 and XRCC1; patients must also be offered participation in banking for future use of specimens","True:Absolute neutrophil count >= 1,500/mcl","True:Platelets >= 100,000/mcl","True:Hemoglobin >= 9.0 g/dl","True:Total bilirubin within institutional upper limit of normal (IULN)","True:Serum glutamic oxaloacetic transaminase (SGOT) (aspartate aminotransferase [AST]) or serum glutamate pyruvate transaminase (SGPT) (alanine aminotransferase [ALT]) =< 2.5 x IULN","True:Patients must not be pregnant or nursing; women/men of reproductive potential must have agreed to use an effective contraceptive method; a woman is considered to be of ""reproductive potential"" if she has had menses at any time in the preceding 12 consecutive months; in addition to routine contraceptive methods, ""effective contraception"" also includes heterosexual celibacy and surgery intended to prevent pregnancy (or with a side-effect of pregnancy prevention) defined as a hysterectomy, bilateral oophorectomy or bilateral tubal ligation; however, if at any point a previously celibate patient chooses to become heterosexually active during the time period for use of contraceptive measures outlined in the protocol, he/she is responsible for beginning contraceptive measures","True:Patients must have a serum creatinine =< the IULN AND measured or calculated creatinine clearance >= 60 cc/min using the Cockroft-Gault formula","True:Patients must have pulmonary function tests (PFTs) including forced expiratory volume in 1 second (FEV1) within 84 days prior to registration; for FEV1, the best value obtained pre- or post-bronchodilator must be >= 1.2 liters/second and/or >= 50% predicted","True:Patients may not be planning to receive any other investigational agents","True:Patients must not have more than 10% weight loss in the past 6 months","True:Patients must not have a history of allergic reactions attributed to compounds of similar chemical or biologic composition to ABT-888, carboplatin, paclitaxel or other agents used in study","True:No other prior malignancy is allowed except for the following: adequately treated basal cell or squamous cell skin cancer, in situ cervical cancer, adequately treated stage I or II cancer from which the patient is currently in complete remission, or any other cancer from which the patient has been disease free for five years","True:Patient must not have any uncontrolled intercurrent illness including, but not limited to ongoing or active infection, symptomatic congestive heart failure, unstable angina pectoris, cardiac arrhythmia, or psychiatric illness/social situations that would limit compliance with study requirements","True:Patients must not currently have a > grade 1 symptomatic neuropathy-sensory (National Cancer Institute [NCI] Common Terminology Criteria for Adverse Events [CTCAE] version 4.0)","True:Patients must not have a history of seizures","True:Patients must not have any known immune deficiencies; patients with immune deficiency are at increased risk of lethal infections when treated with marrow-suppressive therapy; therefore, known human immunodeficiency virus (HIV) positive patients receiving combination anti-retroviral therapy are excluded from the study","True:Patients must be able to swallow whole capsules","True:Prestudy history and physical must be obtained within 28 days prior to registration","True:All patients must be informed of the investigational nature of this study and must sign and give written informed consent in accordance with institutional and federal guidelines","True:As a part of the Oncology Patient Enrollment Network (OPEN) registration process the treating institution’s identity is provided in order to ensure that the current (within 365 days) date of institutional review board approval for this study has been entered in the system","True:REGISTRATION #2 - PRIOR TO CONSOLIDATION CHEMOTHERAPY:","True:REGISTRATION #2 - PRIOR TO CONSOLIDATION CHEMOTHERAPY: Patients must have completed chemoradiotherapy per protocol and at least four weeks but no more than six weeks must have elapsed from the last day of induction therapy (the last day of radiation)","True:REGISTRATION #2 - PRIOR TO CONSOLIDATION CHEMOTHERAPY: Patients must have undergone restaging tests according to the study calendar and determined to have no evidence of disease progression","True:REGISTRATION #2 - PRIOR TO CONSOLIDATION CHEMOTHERAPY: Patients must have a serum creatinine =< (IULN) AND measured of calculated creatinine clearance >= 60 cc/min using the Cockroft-Gault formula","True:REGISTRATION #2 - PRIOR TO CONSOLIDATION CHEMOTHERAPY: Absolute neutrophil count >= 1,500 mcl","True:REGISTRATION #2 - PRIOR TO CONSOLIDATION CHEMOTHERAPY: Platelets >= 100,000/mcl","True:REGISTRATION #2 - PRIOR TO CONSOLIDATION CHEMOTHERAPY: Hemoglobin >= 9.0 g/dl","True:REGISTRATION #2 - PRIOR TO CONSOLIDATION CHEMOTHERAPY: Total bilirubin =< IULN","True:REGISTRATION #2 - PRIOR TO CONSOLIDATION CHEMOTHERAPY: SGOT (AST) or SGPT (ALT) =< 2.5 x IULN","True:REGISTRATION #2 - PRIOR TO CONSOLIDATION CHEMOTHERAPY: Patients must have Zubrod performance status 0-1",""
