"NCI-2012-01695","True:Ability to understand and the willingness to provide written informed consent to participate","True:HIV-1 infection, documented by any licensed rapid HIV test or HIV enzyme or chemiluminescence immunoassay (E/CIA) test kit at any time prior to study entry and confirmed by a licensed Western blot or a second antibody test by a method other than the initial rapid HIV and/or E/CIA, or confirmed by HIV-1 antigen or plasma HIV-1 ribonucleic acid (RNA) viral load > 1,000 copies/mL* NOTE: the term ""licensed"" refers to a United States (U.S.) Food and Drug Administration (FDA)-approved kit or for sites located in countries other than the United States, a kit that has been certified or licensed by an oversight body within that country and validated internally* WHO (World Health Organization) and CDC (Centers for Disease Control and Prevention) guidelines mandate that confirmation of the initial test result must use a test that is different from the one used for the initial assessment; a reactive initial rapid test should be confirmed by either another type of rapid assay or an E/CIA that is based on a different antigen preparation and/or different test principle (e.g., indirect versus competitive), or a Western blot or a plasma HIV-1 RNA viral load","True:Biopsy-proven, systemic DLBCL with a proliferation rate =< 90%, that has been confirmed by an acquired immune deficiency syndrome (AIDS) Malignancy Clinical Trial Consortium (AMC)-approved site pathologist using hematoxylin and eosin (H&E) and immunohistochemical stains; if a hard copy of the pathology report is unavailable at the time of enrollment into the screening segment, a verbal report by the pathologist confirming the diagnosis must be documented in the medical chart; a hardcopy of the pathology report must be available prior to randomization (enrollment into the Treatment Segment); Note: measurable disease is not an entry requirement","True:Pathology slides from tumor tissue obtained by surgical excision or core biopsy must be reviewed by the designated site pathologist, or backup pathologist, prior to study entry; confirmation of the diagnosis must be documented by the AMC-approved pathologist prior to study entry; please reference the AMC-068 Manual of Procedures (MOP) for further instructions on documenting the diagnosis; the site pathologist for non-Hodgkin lymphoma (NHL) must be approved through the AMC's external quality assurance (EQA) process","True:Participants must have fifteen blank (unstained) slides or a diagnostic tissue block must be available for external quality assurance by the AMC Core Pathology Laboratory","True:Eastern Cooperative Oncology Group (ECOG) performance status of 0-3 within 7 days of enrollment","True:Participants must have an estimated life expectancy of > 6 weeks","True:White blood cells (WBC) >= 3,000 cells/uL (3.0 x 10^9 L) or","True:Absolute granulocytes >= 1500 cells/uL (1.5 x 10^9 L)","True:Platelets >= 100,000 cells/uL (75 x 10^9 L); and,","True:Hemoglobin >= 8 g/dL (5.0 mmol/L)","True:Patients may enroll with lower hematologic values, if bone marrow involvement is documented; in this case, patients should be transfused to hemoglobin >= 8 g/dL","True:Estimated creatinine clearance of > 50 ml/min (0.84 mL/s) by the Cockcroft-Gault equation","True:Total bilirubin =< 1.5 times the institutional upper limit of normal (ULN), unless elevated secondary to lymphomatous involvement of liver or biliary system, or due to other HIV medications (e.g., indinavir, tenofovir, or atazanavir); if secondary to lymphomatous involvement, an initial upper limit of total bilirubin 5 mg/dL (85.5 uM/L) should be utilized - for direct bilirubin > 1.2 mg/dL (20.5 uM/L)","True:Aspartate aminotransferase (AST)/alanine aminotransferase (ALT) < 2.5 times the institutional ULN (unless elevated secondary to lymphomatous involvement of the liver, in which case the AST/ALT must be =< 5 times the institutional ULN)","True:Participants must have a lumbar puncture with negative cerebral spinal fluid cytology within 4 weeks prior to enrollment","True:All participants must be prescribed combination antiretroviral therapy with the goal of virological suppression using an acceptable regimen that adheres to national guidelines for treatment of HIV infection; non-suppressed, treatment experienced patients, defined as patients with a viral load > 400 copies/mL who have been on antiretroviral therapy for more than 4 months can be enrolled if an alternative antiretroviral therapy (ART) regimen is available that includes at least two ART drugs that, in the opinion of the site investigator, are expected to have activity based on genotypic testing (if available) and treatment history; patients are not allowed to receive zidovudine (azidothymidine [AZT]) as part of concurrent chemotherapy and ART regimen, since it is myelosuppressive; zidovudine may be discontinued and substituted as clinically indicated prior to or at the time of enrollment","True:Participants of childbearing potential, defined as a sexually mature woman who: 1) has not undergone a hysterectomy or bilateral oophorectomy; or 2) has not been naturally postmenopausal for at least 24 consecutive months (i.e., has had menses at any time in the preceding 24 consecutive months), must have a pregnancy test within 7 days prior to enrollment and agree to use an effective form of contraception (e.g., barrier contraception, highly effective hormonal contraception)","True:Participants must, in the opinion of the investigator, be capable of complying with the protocol","True:Participants must be able to take oral medications","True:Participants must have a CD4 count performed within 30 days of enrollment","False:Inability to provide informed consent","False:Participants who received any lymphoma directed chemotherapy or radiotherapy with the exception of a single dose of intrathecal chemotherapy given at the time of the diagnostic lumbar puncture (spinal tap); patients who received chemotherapy or radiotherapy for Kaposi’s sarcoma > 2 years prior to study enrollment are allowed as long as the prior treatment did not include doxorubicin in its non-liposomal form; prior exposure to liposomal doxorubicin is allowed; prior exposure to intrathecal therapy given as prophylaxis within 30 days is allowed","False:Participants who received greater than 10 days of corticosteroids in the preceding 30 days prior to enrollment; physiologic dosing of steroid is 4-5 mg/m^2/day prednisone, 0.03-0.15 mg/kg/day dexamethasone, or 0.5-0.75 mg/kg/day hydrocortisone; contact the AMC Protocol Team for physiologic dosing limits for other corticosteroids","False:Participants with evidence for central nervous system (CNS) lymphoma on neurological exam and/or with radiographic evidence (if radiographic studies are done) of CNS lymphoma (inclusive of parenchymal, vitreal, or leptomeningeal involvement)","False:Participants with active infection(s) for which they are receiving drug treatment unless the clinical status is judged to be stable and survival is estimated to be at least 6 weeks","False:A medical or psychiatric illness that precludes ability to give informed consent or is likely to interfere with the ability to comply with the protocol stipulations","False:Participants with circumstances that will not permit completion of the study or required follow-up; for instance, if travel to and from treatment site is an issue","False:Pregnant or breastfeeding","False:Inability to swallow oral medications","False:Participants with known congestive heart failure (CHF); if known, patients with left ventricular ejection fraction (LVEF) =< 40% are excluded","c15220:affirmed;c15220:affirmed;"
"NCI-2012-01712","True:Patients must have histologically confirmed relapsed or refractory mantle cell lymphoma or low grade B-cell non-Hodgkin lymphoma (NHL); patients with evidence of transformation to a high grade histology will not be eligible","True:Measurable or evaluable disease, as defined in 2008 Revised Response Criteria for Malignant Lymphoma; baseline scans used for measurement should be obtained within 30 days of registration, and baseline bone marrow biopsy and/or aspiration should be obtained with 90 days of registration","True:Patients may have received one or more lines of prior chemotherapy with/without rituximab (including high dose therapy plus stem cell transplant which is counted as one regimen); prior bortezomib is allowed; patients must not have received bortezomib in the past 6 months","True:Patients with human immunodeficiency virus (HIV) who are not receiving cytochrome p450 inhibitors, and who have a minimum of 300+ CD4+ cells/mm^3, an undetectable viral load, and no history of acquired immune deficiency syndrome (AIDS) indicator conditions","True:Patients must be able to take oral medication and to maintain a fast as required for 2 hours before and 1 hour after MLN8237 administration","True:Eastern Cooperative Oncology Group (ECOG) performance status 0, 1, or 2 (Karnofsky >= 60%)","True:Obtained within 30 days of registration: Leukocytes >= 3,000/mcL","True:Obtained within 30 days of registration: Absolute neutrophil count >= 1,500/mcL","True:Obtained within 30 days of registration: Platelets >= 75,000/mcL or >= 50,000/mcL with documented bone marrow involvement","True:Obtained within 30 days of registration: Total bilirubin within normal institutional limits (may be elevated if direct bilirubin normal)","True:Obtained within 30 days of registration: Aspartate aminotransferase (AST) (serum glutamic oxaloacetic transaminase [SGOT])/alanine aminotransferase (ALT) (serum glutamate pyruvate transaminase [SGPT]) < 3 X institutional upper limit of normal","True:Obtained within 30 days of registration: Creatinine within normal institutional limits OR creatinine clearance >= 60 mL/min/1.73 m^2 for patients with creatinine levels above institutional normal","True:Women of child-bearing potential and men must agree to use adequate contraception (hormonal or barrier method of birth control; abstinence) prior to study entry and for the duration of study participation; should a woman become pregnant or suspect she is pregnant while she or her partner is participating in this study, she should inform her treating physician immediately; men treated on this protocol must also agree to use adequate contraception prior to the study, for the duration of study participation, and 4 months after completion of MLN8237 administration","True:Ability to understand and the willingness to sign a written informed consent document","False:Patients who have had chemotherapy or radiotherapy within 4 weeks (6 weeks for nitrosoureas or mitomycin C, 3 weeks for rituximab) prior to entering the study or those who have not recovered from adverse events due to agents administered more than 4 weeks earlier","False:Patients who are receiving any other investigational agents","False:Patients with known brain metastases should be excluded from this clinical trial","False:History of allergic reactions attributed to compounds of similar chemical or biologic composition to MLN8237, bortezomib or rituximab","False:Uncontrolled intercurrent illness including, but not limited to, ongoing or active infection, symptomatic congestive heart failure, unstable angina pectoris, cardiac arrhythmia, or psychiatric illness/social situations that would limit compliance with study requirements","False:Known history of uncontrolled sleep apnea syndrome and other conditions that could result in excessive daytime sleepiness, such as severe chronic obstructive pulmonary disease; requirement for supplemental oxygen, or any conditions that could result in excessive toxicity associated with the benzodiazepine-like effects of MLN8237","False:Inability to swallow oral medication or to maintain a fast as required for 2 hours before and 1 hour after MLN8237 administration or any condition that would modify small bowel absorption of oral medications, including malabsorption, or resection of pancreas or upper bowel","False:Pregnant women are excluded from this study; breastfeeding should be discontinued if the mother is treated with MLN8237","False:HIV-positive patients on combination antiretroviral therapy which include cytochrome p450 inhibitors are ineligible; patients with CD4 counts less than 300 CD4+ cells/mm^3 and or a high viral load are ineligible","False:Grade 2 or greater neuropathy","False:The following agents are not permitted while patients are taking MLN8237, and should be discontinued at prior to registration if patients are taking them:* Patients must stop using the proton pump inhibitor (PPI) for at least 4 days prior to the first dose of MLN8237; administration of PPI while on study is not permitted* Histamine-2 (H2) receptor antagonists are not permitted from the day prior through to the end of MLN8237 dosing, except as required for premedication for rituximab; constant dosing of H2 blockers is not permitted* Antacid preparations are not permitted for 2 hours before or 2 hours after administration of MLN8237* Administration of pancreatic enzymes is not permitted at any time while on study* Co-administration of enzyme-inducing antiepileptic drugs, rifampin, rifabutin, rifapentine or St. John's wort is not permitted* Concurrent bisphosphonate therapy is allowed if it was started before study entry and is maintained at recommended dosing intervals; if bisphosphonate therapy is initiated after study entry, bone lesions will not be considered evaluable for disease response* Patients must be willing not drive, operate dangerous tools or machinery, or engage in any other potentially hazardous activity that requires full alertness and coordination if they experience excessive sedation; if a patient experiences excessive sedation believed to be related to MLN8237, treatment with MLN8237 should be interrupted* Patients must be willing to limit alcohol consumption to no more than 1 standard unit of alcohol (12 oz beer [350 mL], 1.5 oz [45 mL] of 80-proof alcohol, or one 6-oz [175 mL] glass of wine) per day during the study and for 30 days from the last dose of MLN8237; minimize the use of agents with central nervous system (CNS) effects* Benzodiazepine use is discouraged but not prohibited","c15175:affirmed;c15175:affirmed;c111374:affirmed;:affirmed;measurement:affirmed;c111568:affirmed;c92544:affirmed;c2851:affirmed;"
"NCI-2012-01964","True:Patients with locally advanced, previously untreated squamous cell carcinoma of the vulva","True:Patients with T2 or T3 primary tumors (N0-3, M0) not amenable to surgical resection by standard radical vulvectomy","True:Absolute neutrophil count (ANC) >= 1,500/mcl","True:Platelets >= 100,000/mcl","True:Creatinine =< 1.5 times institutional upper limit of normal (ULN) OR calculated creatinine clearance >= 60 mL/min","True:Bilirubin =< 1.5 x ULN","True:Aspartate aminotransferase (AST) and alanine aminotransferase (ALT) =< 3.0 x ULN","True:Alkaline phosphatase =< 3 x ULN","True:Patients judged capable of tolerating a radical course of chemoradiation therapy","True:Patients must not be eligible for a higher priority Gynecologic Oncology Group (GOG) protocol, if one exists; in general, this would refer to any active GOG Phase III protocol or Rare Tumor protocol for the same patient population","True:Patients must have signed an approved informed consent and authorization permitting release of personal health information","True:Patients with a GOG performance status of 0, 1, or 2","False:Patients with recurrent carcinoma of the vulva regardless of previous treatment","False:Patients who have received prior pelvic radiation or cytotoxic chemotherapy","False:Patients with vulvar melanomas or sarcomas","False:Patients with circumstances that will not permit completion of the study or the required follow-up","False:Patients with evidence of active septicemia, severe infection, gastrointestinal bleeding or severe gastrointestinal symptoms requiring medical or surgical therapy","False:Patients with a history of other invasive malignancies, with the exception of non-melanoma skin cancer, are excluded if there is any evidence of other malignancy being present within the last five years; patients are also excluded if their previous cancer treatment contraindicates this protocol therapy",""
"NCI-2012-01967","True:Patients must be newly diagnosed with localized primary CNS NGGCT (Stratum 1) or localized primary CNS germinoma (Stratum 2); germ cell tumors located in the suprasellar, pineal, bifocal (pineal + suprasellar) and ventricles are eligible; tumors present in the above mentioned locations and with unifocal parenchymal extension are eligible* Stratum 1(NGGCT): Patients must have one of the following criteria:** Patients with serum and/or CSF hCGbeta > 100 mIU/mL or any elevation of serum and/or CSF alpha-fetoprotein (AFP) > 10 ng/mL or greater than the institutional normal are eligible, irrespective of biopsy results** Patients with any of the following elements on biopsy/resection are eligible, irrespective of serum and/or CSF hCGbeta and AFP levels: endodermal sinus tumor (yolk sac), embryonal carcinoma, choriocarcinoma, malignant/immature teratoma, and mixed GCT with malignant GCT elements* Stratum 2 (Germinoma): Patients must have both serum and CSF markers obtained (unless obtaining CSF is medically contraindicated) and must have one of the following criteria to be eligible:** Patients with institutional normal AFP (or =< 10 ng/mL if no institutional normal exists) in both serum and CSF (unless medically contraindicated) AND hCGbeta 5 to =< 50 mIU/mL in serum and/or CSF (unless medically contraindicated) (only 1 is required to be elevated) are eligible; no histologic confirmation required** Patients with bifocal (pineal + suprasellar) involvement or pineal lesion with diabetes insipidus (D1) AND hCGbeta =< 100 mIU/mL in serum and/or CSF AND institutional normal AFP (or =< 10 ng/mL if no institutional normal exists) in both serum and CSF (unless medically contraindicated) are eligible; no histologic confirmation required** Patients with histologically confirmed germinoma or germinoma mixed with mature teratoma and hCGbeta =< 100 mIU/mL in serum and/or CSF and institutional normal AFP (or =< 10 ng/mL if no institutional normal exists) in both serum and CSF (unless medically contraindicated) are eligible","True:All patients must have a cranial MRI with and without gadolinium at diagnosis/prior to enrollment; if surgical resection is performed, patients must have pre-operative and post-operative cranial MRI with and without gadolinium; the post-operative brain MRI should be obtained within 72 hours of surgery; if patient has a biopsy only, post-operative cranial MRI is recommended but not required; all patients must have a spine MRI with gadolinium obtained at diagnosis/prior to enrollment; Note: if the spine study is performed for the first time after surgical resection or biopsy, it is recommended to be obtained with and without gadolinium","True:Lumbar CSF must be obtained prior to study enrollment unless medically contraindicated; if a patient undergoes surgery and lumbar CSF cannot be obtained at this time, then it should be performed at least 10 days following surgery before study enrollment; false positive cytology can occur within 10 days of surgery; Note: patients with positive CSF cytology obtained prior to 10 days after surgery may have cytology repeated to determine eligibility","True:Patients must have CSF tumor markers obtained prior to enrollment unless medically contraindicated; ventricular CSF obtained at the time of CSF diversion procedure (if performed) is acceptable for tumor markers but lumbar CSF is preferred; in case CSF diversion and biopsy/surgery are combined, CSF tumor markers should be collected first","True:Patients must be enrolled on ALTE07C1 prior to enrollment on ACNS1123; patients must be enrolled within 31 days of definitive diagnostic surgery (day 0) or clinical diagnosis","True:Peripheral absolute neutrophil count (ANC) >= 1,000/uL","True:Platelet count >= 100,000/uL (transfusion independent)","True:Hemoglobin >= 8.0 g/dL (may receive red blood cell [RBC] transfusions)","True:Creatinine clearance or radioisotope glomular filtration rate (GFR) >= 70 mL/min/1.73 m^2 OR serum creatinine based on age/gender as follows:* 0.8 mg/dL (2 to < 6 years of age) * 1.0 mg/dL (6 to < 10 years of age)* 1.2 mg/dL (10 to < 13 years of age) * 1.5 mg/dL (male) and 1.4 mg/dL (female) (13 to < 16 years of age)* 1.7 mg/dL (male) and 1.4 mg/dL (female) (>= 16 years of age)","True:Total bilirubin =< 1.5 times upper limit of normal (ULN) for age","True:Serum glutamic oxaloacetic transaminase (SGOT) (aspartate aminotransferase [AST]) and serum glutamate pyruvate transaminase (SGPT) (alanine aminotransferase [ALT]) < 2.5 times ULN","True:Patients with seizure disorder may be enrolled if well controlled","True:Patients must not be in status, coma, or assisted ventilation prior to study enrollment","False:Patients with mature teratoma or completely resected immature teratoma with normal tumor markers are not eligible","False:Patients with tumors located outside the ventricles (basal ganglia, thalamus) are not eligible","False:Patients with metastatic disease by cranial or spinal MRI evaluation or CSF cytology (unless medically contraindicated) are not eligible","False:Patients must not have received any prior tumor-directed therapy other than surgical intervention and corticosteroids","False:Female patients who are pregnant are ineligible","False:Lactating females are not eligible unless they have agreed not to breastfeed their infants","False:Female patients of childbearing potential are not eligible unless a negative pregnancy test result has been obtained","False:Sexually active patients of reproductive potential are not eligible unless they have agreed to use an effective contraceptive method for the duration of their study participation","False:All patients and/or their parents or legal guardians must sign a written informed consent","False:All institutional, Food and Drug Administration (FDA), and National Cancer Institute (NCI) requirements for human studies must be met","c63350:affirmed;"
